<!ELEMENT save (data, board, history) >
<!ELEMENT data (computer?, current, end) >
<!ELEMENT computer EMPTY>
<!ELEMENT current (#PCDATA)>
<!ELEMENT end (#PCDATA)>
<!ELEMENT board (row+) >
<!ELEMENT row (cell+) >
<!ELEMENT cell (#PCDATA) >
<!ATTLIST player mode (human | computer) #REQUIRED>
<!ATTLIST computer level (EASY | MEDIUM | HARD) #REQUIRED>
<!ELEMENT history (act*) >
<!ELEMENT act (coordinate, p) >
<!ELEMENT coordinate (abscissa, ordinate) >
<!ELEMENT p (#PCDATA) >
<!ELEMENT abscissa (#PCDATA) >
<!ELEMENT ordinate (#PCDATA) >