<?xml version="1.0" encoding="UTF-8" standalone="no" ?>
<!DOCTYPE save SYSTEM "save.dtd">

<save>
    <data>
        <computer level="EASY"></computer>
        <current>0</current>
    </data>
    <board>
        <row>
            <cell />
            <cell>0</cell>
            <cell></cell>
            <cell />
        </row>
        <row>
            <cell>0</cell>
            <cell />
            <cell />
            <cell>1</cell>
        </row>
        <row>
            <cell>0</cell>
            <cell />
            <cell>1</cell>
            <cell>1</cell>
        </row>
        <row>
            <cell>0</cell>
            <cell />
            <cell />
            <cell>0</cell>
        </row>
    </board>
</save>