<?xml version="1.0" encoding="UTF-8" standalone="no"?>
<!DOCTYPE save SYSTEM "save.dtd">
<save>
  <data>
    <current>0</current>
    <end>0</end>
  </data>
  <board>
    <row>
      <cell/>
      <cell/>
      <cell/>
      <cell/>
      <cell/>
      <cell/>
      <cell/>
      <cell/>
      <cell/>
      <cell/>
    </row>
    <row>
      <cell/>
      <cell/>
      <cell/>
      <cell/>
      <cell/>
      <cell/>
      <cell/>
      <cell>0</cell>
      <cell>0</cell>
      <cell/>
    </row>
    <row>
      <cell/>
      <cell/>
      <cell/>
      <cell/>
      <cell/>
      <cell/>
      <cell/>
      <cell/>
      <cell>1</cell>
      <cell/>
    </row>
    <row>
      <cell/>
      <cell/>
      <cell/>
      <cell/>
      <cell/>
      <cell/>
      <cell/>
      <cell>1</cell>
      <cell/>
      <cell/>
    </row>
    <row>
      <cell/>
      <cell/>
      <cell/>
      <cell/>
      <cell/>
      <cell/>
      <cell/>
      <cell/>
      <cell/>
      <cell/>
    </row>
    <row>
      <cell/>
      <cell/>
      <cell/>
      <cell/>
      <cell/>
      <cell/>
      <cell/>
      <cell/>
      <cell/>
      <cell/>
    </row>
    <row>
      <cell/>
      <cell/>
      <cell/>
      <cell/>
      <cell/>
      <cell/>
      <cell/>
      <cell/>
      <cell/>
      <cell/>
    </row>
    <row>
      <cell/>
      <cell/>
      <cell/>
      <cell/>
      <cell/>
      <cell/>
      <cell/>
      <cell/>
      <cell/>
      <cell/>
    </row>
    <row>
      <cell/>
      <cell/>
      <cell/>
      <cell/>
      <cell/>
      <cell/>
      <cell/>
      <cell/>
      <cell/>
      <cell/>
    </row>
    <row>
      <cell/>
      <cell/>
      <cell/>
      <cell/>
      <cell/>
      <cell/>
      <cell/>
      <cell/>
      <cell/>
      <cell/>
    </row>
  </board>
  <history>
    <act>
      <coordinate>
        <abscissa>1</abscissa>
        <ordinate>7</ordinate>
      </coordinate>
      <p>0</p>
    </act>
    <act>
      <coordinate>
        <abscissa>3</abscissa>
        <ordinate>7</ordinate>
      </coordinate>
      <p>1</p>
    </act>
    <act>
      <coordinate>
        <abscissa>1</abscissa>
        <ordinate>8</ordinate>
      </coordinate>
      <p>0</p>
    </act>
    <act>
      <coordinate>
        <abscissa>2</abscissa>
        <ordinate>8</ordinate>
      </coordinate>
      <p>1</p>
    </act>
  </history>
</save>
